{"audit_ref":"099a2ea5-45c4-415c-a750-7cce9d40725a","automatic_export":false,"created_at":"2026-06-23T08:51:58Z","created_by_authority":"user","device_signature":null,"encrypted":false,"export_id":"d82bc6d3-0c5f-4f3f-93df-29c855f68142","export_type":"full_export","included_files":[{"content_type":"application/jsonl","hash":"04779edede9f05b236af2a264843dd0451152952dea3b6667c27c181bc1b6cf7","path":"audit_chain.jsonl"},{"content_type":"application/json","hash":"f1e27713982e2a4d7b08487ca1f8e377352a9931801d248822e173893a5361e9","path":"policy_snapshot.json"},{"content_type":"application/json","hash":"6a684e7b766bca9671ee0a6c1e5887956a45c19ccd62b77ae39a6959d830fd33","path":"baseline_summary.json"},{"content_type":"application/json","hash":"d9597f00adbbd29c0d566432c038eadec0ebb7d90c224e741e9caad0caa84ae7","path":"local_status_report.json"},{"content_type":"text/markdown","hash":"c549c78e2c7da45cee73982d40232a5273692032f7664797bb3e0b140acdc26b","path":"human_readable_summary.md"},{"content_type":"text/markdown","hash":"cbe34feb79351b985374a707df061fdeb023451c706a11cc47b58a713dfa4865","path":"verification_instructions.md"}],"range_end_sequence":4,"range_start_sequence":1,"recipient":null,"redactions_applied":false,"request_audit_ref":"aa3f9f09-cfa2-4296-865e-0024880addf9","schema_version":"0.2","user_confirmed":true}